{
  "requestVersion": "1.0",
  "mode": "ATTACH",
  "collaboration": "INDIVIDUAL",
  "objective": "Continue delivery after the target is identified.",
  "preferredSkill": null,
  "artifacts": [],
  "facts": [],
  "decisions": [],
  "evidence": [],
  "unknowns": ["The repository target is ambiguous."],
  "constraints": ["Do not edit an unidentified target."],
  "stopReasons": ["The repository target is ambiguous and cannot be selected safely."]
}
