{
  "requestVersion": "1.0",
  "mode": "NEW",
  "collaboration": "TEAM",
  "objective": "Deliver one bounded change with explicit team ownership.",
  "preferredSkill": null,
  "artifacts": [
    { "type": "refined-scope", "reference": "docs:team-scope-v1", "state": "COMPLETE", "bindsTo": null },
    { "type": "acceptance-criteria", "reference": "docs:team-acceptance-v1", "state": "COMPLETE", "bindsTo": null },
    { "type": "decision-record", "reference": "docs:team-decisions-v1", "state": "COMPLETE", "bindsTo": null },
    { "type": "plan-handoff", "reference": "docs:team-plan-v1", "state": "COMPLETE", "bindsTo": null }
  ],
  "facts": ["Several contributors will share the delivery outcome."],
  "decisions": ["Use team mode before implementation."],
  "evidence": ["docs:team-plan-v1"],
  "unknowns": ["Artifact ownership has not been assigned."],
  "constraints": ["Exactly one lead must own each shared artifact."],
  "stopReasons": []
}
