{
  "requestVersion": "1.0",
  "mode": "AUTO",
  "collaboration": "INDIVIDUAL",
  "objective": "Deliver one bounded, reviewable software change.",
  "preferredSkill": null,
  "artifacts": [],
  "facts": ["The active repository is the declared delivery target."],
  "decisions": [],
  "evidence": [],
  "unknowns": [],
  "constraints": ["No hidden external action."],
  "stopReasons": []
}
