{
  "requestVersion": "1.0",
  "mode": "RESUME",
  "collaboration": "INDIVIDUAL",
  "objective": "Deliver one bounded, reviewable software change.",
  "preferredSkill": null,
  "artifacts": [
    { "type": "refined-scope", "reference": "docs:scope-v1", "state": "COMPLETE", "bindsTo": null },
    { "type": "acceptance-criteria", "reference": "docs:acceptance-v1", "state": "COMPLETE", "bindsTo": null },
    { "type": "decision-record", "reference": "docs:decisions-v1", "state": "COMPLETE", "bindsTo": null },
    { "type": "plan-handoff", "reference": "docs:plan-v1", "state": "COMPLETE", "bindsTo": null },
    { "type": "accepted-plan", "reference": "user-decision:accept-plan-v1", "state": "ACCEPTED", "bindsTo": "docs:plan-v1" },
    { "type": "repository-verified", "reference": "git:working-tree-v1", "state": "VERIFIED", "bindsTo": null },
    { "type": "reviewable-diff", "reference": "git:working-tree", "state": "COMPLETE", "bindsTo": null },
    { "type": "implementation-evidence", "reference": "local:implementation-evidence-v1", "state": "COMPLETE", "bindsTo": null },
    { "type": "residual-risk-record", "reference": "local:implementation-risks-v1", "state": "COMPLETE_WITH_LIMIT", "bindsTo": null },
    { "type": "validation-result", "reference": "local:validation-result-v1", "state": "COMPLETE", "bindsTo": null },
    { "type": "test-evidence", "reference": "local:test-evidence-v1", "state": "COMPLETE", "bindsTo": null },
    { "type": "evidence-map", "reference": "local:evidence-map-v1", "state": "COMPLETE", "bindsTo": null },
    { "type": "review-result", "reference": "local:review-result-v1", "state": "COMPLETE", "bindsTo": null },
    { "type": "review-evidence", "reference": "local:review-evidence-v1", "state": "COMPLETE", "bindsTo": null },
    { "type": "review-limit-record", "reference": "local:review-limits-v1", "state": "COMPLETE_WITH_LIMIT", "bindsTo": null },
    { "type": "delivery-handoff", "reference": "docs:delivery-handoff-v1", "state": "COMPLETE", "bindsTo": null }
  ],
  "facts": ["All declared delivery Skills produced reviewable artifacts."],
  "decisions": ["The User accepted docs:plan-v1 for implementation."],
  "evidence": ["local:evidence-map-v1", "local:review-evidence-v1"],
  "unknowns": [],
  "constraints": ["Publication and release remain separate User decisions."],
  "stopReasons": []
}
