{
  "requestVersion": "1.0",
  "mode": "NEW",
  "collaboration": "INDIVIDUAL",
  "objective": "Deliver one bounded, reviewable software change.",
  "preferredSkill": null,
  "artifacts": [
    { "type": "refined-scope", "reference": "docs:scope-v1", "state": "COMPLETE", "bindsTo": null },
    { "type": "acceptance-criteria", "reference": "docs:acceptance-v1", "state": "COMPLETE", "bindsTo": null },
    { "type": "decision-record", "reference": "docs:decisions-v1", "state": "COMPLETE", "bindsTo": null },
    { "type": "plan-handoff", "reference": "docs:plan-v1", "state": "COMPLETE", "bindsTo": null }
  ],
  "facts": ["Planning artifacts are reviewable."],
  "decisions": [],
  "evidence": ["docs:plan-v1"],
  "unknowns": [],
  "constraints": ["Implementation requires an exact human acceptance binding."],
  "stopReasons": []
}
